{
  "profile_version": "1.0.0",
  "materializer_id": "mat_synthjoin2026",
  "observation_id": "obs_synthjoin2026",
  "mapping_shape": "many-to-one-join",
  "allowed_book_codes": [
    "SYN"
  ],
  "source_system": {
    "system_key": "synthetic-join-source-v1",
    "versification_system_id": "vrs_vrirhrhcq2s255id7qlr",
    "reference_id_namespace": "bible-os:synthetic-split-join:v1:join-source",
    "reference_key_template": "join-source|{reference}",
    "name": "Synthetic join source",
    "version": "1",
    "authority": "Bible OS synthetic fixture"
  },
  "target_system": {
    "system_key": "synthetic-join-target-v1",
    "versification_system_id": "vrs_ky3sagrofgbmrgu7va2a",
    "reference_id_namespace": "bible-os:synthetic-split-join:v1:join-target",
    "reference_key_template": "join-target|{reference}",
    "name": "Synthetic join target",
    "version": "1",
    "authority": "Bible OS synthetic fixture"
  },
  "canonical_identity": {
    "namespace": "bible-os:synthetic-split-join:v1:join-components",
    "passage_key_template": "join-component-{ordinal}",
    "identity_status": "synthetic-canonical-component"
  },
  "mapping_state": {
    "method": "synthetic-reference-observation-v1",
    "review_state": "synthetic-reviewed"
  },
  "preservation_checks": [],
  "publication_eligible": false
}
